<?xml version="1.0" encoding="UTF-8"?>
<!-- Contenido de tu documento XML -->
<biblioteca xmlns:xsi = "http://www.w3.org/2001/XMLSchema-instance"
           xsi:noNamespaceSchemaLocation="BibliotecaInformatica.xsd">    

    <facultad>Informática</facultad>
    <Campus>Escuela Politécnica de Valencia </Campus>
    <secciones>
        <seccion nombre="Programación">
            <libros>
                <libro ID="A001" isbn="666-1234567890" titulo="Introducción a la Programación en Java" numero_de_paginas="300">
                    <autores>
                        <autor>John Smith</autor>
                        <autor>Maria Pérez</autor>
                        <autor>Carlos Rodríguez</autor>
                    </autores>
                    <fechaEdicion>12-12-2012</fechaEdicion>
                    <editorial>Paraninfo</editorial>
                    <precio>29</precio>
                    <copias>
                        <copia numero="1" estado="Disponible"/>
                        <copia numero="2" estado="Prestado"/>
                        <copia numero="3" estado="Disponible"/>
                    </copias>
                </libro>
                <libro ID="A002" isbn="988-1111111111" titulo="Aprende Java en 21 días" numero_de_paginas="400">
                    <autores>
                        <autor>Luis Martínez</autor>
                        <autor>John Smith</autor>
                        <autor>Maria Pérez</autor>
                    </autores>
                    <fechaEdicion>02-10-2015</fechaEdicion>
                    <editorial>Anaya Multimedias</editorial>
                    <precio>39.99</precio>
                    <copias>
                        <copia numero="1" estado="Disponible"/>
                        <copia numero="2" estado="Prestado"/>
                    </copias>
                </libro>
                <libro ID="A003" isbn="988-8822222222" titulo="Python para Principiantes" numero_de_paginas="250">
                    <autores>
                        <autor>María López</autor>
                        <autor>Carlos Rodríguez</autor>
                    </autores>
                    <fechaEdicion>02-09-2015</fechaEdicion>
                    <editorial>Coders Press</editorial>
                    <precio>24.99</precio>
                    <copias>
                        <copia numero="1" estado="Disponible"/>
                        <copia numero="2" estado="Disponible"/>
                        <copia numero="3" estado="Prestado"/>
                    </copias>
                </libro>
                <libro ID="A004" isbn="988-3633333333" titulo="Desarrollo de Aplicaciones Web con Java" numero_de_paginas="350">
                    <autores>
                        <autor>John Smith</autor>
                        <autor>Luis Martínez</autor>
                    </autores>
                    <fechaEdicion>05-03-2022</fechaEdicion>
                    <editorial>Paraninfo</editorial>
                    <precio>32.99</precio>
                    <copias>
                        <copia numero="1" estado="Disponible"/>
                        <copia numero="2" estado="Disponible"/>
                        <copia numero="3" estado="Disponible"/>
                    </copias>
                </libro>
                <libro ID="A005" isbn="968-2224444444" titulo="Programación Avanzada en Java" numero_de_paginas="280">
                    <autores>
                        <autor>Carlos Rodríguez</autor>
                        <autor>John Smith</autor>
                        <autor>Luis Martínez</autor>
                    </autores>
                    <fechaEdicion>04-10-2022</fechaEdicion>
                    <editorial>Anaya Multimedias</editorial>
                    <precio>29.99</precio>
                    <copias>
                        <copia numero="1" estado="Disponible"/>
                        <copia numero="2" estado="Prestado"/>
                        <copia numero="3" estado="Disponible"/>
                        <copia numero="4" estado="Disponible"/>
                        <copia numero="5" estado="Prestado"/>
                    </copias>
                </libro>
            </libros>
        </seccion>
        <seccion nombre="Redes">
            <libros>
                <libro ID="A101" isbn="998-5588555555" titulo="Comunicación en Redes Empresariales" numero_de_paginas="380">
                    <autores>
                        <autor>Luis Martínez</autor>
                        <autor>Maria Pérez</autor>
                    </autores>
                    <fechaEdicion>04-10-2022</fechaEdicion>
                    <editorial>Paraninfo</editorial>
                    <precio>34.99</precio>
                    <copias>
                        <copia numero="1" estado="Disponible"/>
                        <copia numero="2" estado="Prestado"/>
                        <copia numero="3" estado="Disponible"/>
                        <copia numero="4" estado="Disponible"/>
                    </copias>
                </libro>
                <libro ID="A102" isbn="878-6546666666" titulo="Seguridad en Redes Corporativas" numero_de_paginas="420">
                    <autores>
                        <autor>John Smith</autor>
                        <autor>Maria Pérez</autor>
                        <autor>Carlos Rodríguez</autor>
                    </autores>
                    <fechaEdicion>09-09-2021</fechaEdicion>
                    <editorial>Rama</editorial>
                    <precio>39.99</precio>
                    <copias>
                        <copia numero="1" estado="Disponible"/>
                        <copia numero="2" estado="Disponible"/>
                        <copia numero="3" estado="Disponible"/>
                        <copia numero="4" estado="Prestado"/>
                        <copia numero="5" estado="Disponible"/>
                    </copias>
                </libro>
                <libro ID="A103" isbn="878-8767777777" titulo="Introducción a las Redes de Comunicación" numero_de_paginas="320">
                    <autores>
                        <autor>María López</autor>
                        <autor>Carlos Rodríguez</autor>
                    </autores>
                    <fechaEdicion>14-04-2020</fechaEdicion>
                    <editorial>Anaya Multimedia</editorial>
                    <precio>29.99</precio>
                    <copias>
                        <copia numero="1" estado="Disponible"/>
                        <copia numero="2" estado="Disponible"/>
                        <copia numero="3" estado="Prestado"/>
                        <copia numero="4" estado="Disponible"/>
                    </copias>
                </libro>
                <libro ID="A104" isbn="978-8888888323" titulo="Redes Avanzadas y Protocolos de Comunicación" numero_de_paginas="350">
                    <autores>
                        <autor>John Smith</autor>
                        <autor>Luis Martínez</autor>
                        <autor>Carlos Rodríguez</autor>
                    </autores>
                    <fechaEdicion>21-12-2022</fechaEdicion>
                    <editorial>Marcombo</editorial>
                    <precio>32.00</precio>
                    <copias>
                        <copia numero="1" estado="Disponible"/>
                        <copia numero="2" estado="Prestado"/>
                        <copia numero="3" estado="Disponible"/>
                    </copias>
                </libro>
                <libro ID="A105" isbn="968-9999999543" titulo="Comunicación de Datos en Redes Empresariales" numero_de_paginas="290">
                    <autores>
                        <autor>Carlos Rodríguez</autor>
                        <autor>John Smith</autor>
                        <autor>Luis Martínez</autor>
                    </autores>
                    <fechaEdicion>04-12-2021</fechaEdicion>
                    <editorial>Paraninfo</editorial>
                    <precio>25.50</precio>
                    <copias>
                        <copia numero="1" estado="Disponible"/>
                        <copia numero="2" estado="Prestado"/>
                        <copia numero="3" estado="Disponible"/>
                        <copia numero="4" estado="Disponible"/>
                    </copias>
                </libro>
                <libro ID="A106" isbn="778-1010101032" titulo="Seguridad en Redes Empresariales" numero_de_paginas="400">
                    <autores>
                        <autor>Luis Martínez</autor>
                        <autor>Maria Pérez</autor>
                    </autores>
                    <fechaEdicion>12-03-2020</fechaEdicion>
                    <editorial>Anaya Multimedia</editorial>
                    <precio>34.5</precio>
                    <copias>
                        <copia numero="1" estado="Disponible"/>
                        <copia numero="2" estado="Prestado"/>
                        <copia numero="3" estado="Disponible"/>
                        <copia numero="4" estado="Disponible"/>
                    </copias>
                </libro>
                <libro ID="A107" isbn="343-1111114545" titulo="Introducción a la Comunicación en Redes" numero_de_paginas="350">
                    <autores>
                        <autor>María López</autor>
                        <autor>Carlos Rodríguez</autor>
                    </autores>
                    <fechaEdicion>15-07-2021</fechaEdicion>
                    <editorial>Marcombo</editorial>
                    <precio>32.99</precio>
                    <copias>
                        <copia numero="1" estado="Disponible"/>
                        <copia numero="2" estado="Prestado"/>
                        <copia numero="3" estado="Disponible"/>
                        <copia numero="4" estado="Disponible"/>
                    </copias>
                </libro>